{
  "label": "sample-ai-ready",
  "model_state": "ai-ready",
  "illustrative": true,
  "created": "2026-01-15T00:00:00Z",
  "agent": "question-tester",
  "surface": "generated",
  "notes": "Illustrative: answers from the AI-ready model using its measures. Not live agent output.",
  "answers": [
    {
      "question_id": "Q01",
      "answer_text": "Prescriptions Filled by Region and Year Month for January 2024 to December 2025.",
      "dax": "EVALUATE\nSUMMARIZECOLUMNS(\n    'Store'[Region],\n    'Date'[Year Month],\n    \"Prescriptions Filled\", [Prescriptions Filled]\n)\nORDER BY 'Store'[Region], 'Date'[Year Month]",
      "assumptions": [
        "Count every fill, new prescriptions and refills together, by store region and calendar month for all 24 months in the data (January 2024 to December 2025)."
      ],
      "rows": [
        {
          "region": "East",
          "year_month": "2024-01",
          "prescriptions_filled": 454
        },
        {
          "region": "East",
          "year_month": "2024-02",
          "prescriptions_filled": 436
        },
        {
          "region": "East",
          "year_month": "2024-03",
          "prescriptions_filled": 438
        },
        {
          "region": "East",
          "year_month": "2024-04",
          "prescriptions_filled": 396
        },
        {
          "region": "East",
          "year_month": "2024-05",
          "prescriptions_filled": 445
        },
        {
          "region": "East",
          "year_month": "2024-06",
          "prescriptions_filled": 441
        },
        {
          "region": "East",
          "year_month": "2024-07",
          "prescriptions_filled": 453
        },
        {
          "region": "East",
          "year_month": "2024-08",
          "prescriptions_filled": 378
        },
        {
          "region": "East",
          "year_month": "2024-09",
          "prescriptions_filled": 409
        },
        {
          "region": "East",
          "year_month": "2024-10",
          "prescriptions_filled": 440
        },
        {
          "region": "East",
          "year_month": "2024-11",
          "prescriptions_filled": 448
        },
        {
          "region": "East",
          "year_month": "2024-12",
          "prescriptions_filled": 468
        },
        {
          "region": "East",
          "year_month": "2025-01",
          "prescriptions_filled": 478
        },
        {
          "region": "East",
          "year_month": "2025-02",
          "prescriptions_filled": 406
        },
        {
          "region": "East",
          "year_month": "2025-03",
          "prescriptions_filled": 474
        },
        {
          "region": "East",
          "year_month": "2025-04",
          "prescriptions_filled": 406
        },
        {
          "region": "East",
          "year_month": "2025-05",
          "prescriptions_filled": 481
        },
        {
          "region": "East",
          "year_month": "2025-06",
          "prescriptions_filled": 436
        },
        {
          "region": "East",
          "year_month": "2025-07",
          "prescriptions_filled": 463
        },
        {
          "region": "East",
          "year_month": "2025-08",
          "prescriptions_filled": 442
        },
        {
          "region": "East",
          "year_month": "2025-09",
          "prescriptions_filled": 419
        },
        {
          "region": "East",
          "year_month": "2025-10",
          "prescriptions_filled": 471
        },
        {
          "region": "East",
          "year_month": "2025-11",
          "prescriptions_filled": 466
        },
        {
          "region": "East",
          "year_month": "2025-12",
          "prescriptions_filled": 539
        },
        {
          "region": "North",
          "year_month": "2024-01",
          "prescriptions_filled": 466
        },
        {
          "region": "North",
          "year_month": "2024-02",
          "prescriptions_filled": 450
        },
        {
          "region": "North",
          "year_month": "2024-03",
          "prescriptions_filled": 461
        },
        {
          "region": "North",
          "year_month": "2024-04",
          "prescriptions_filled": 451
        },
        {
          "region": "North",
          "year_month": "2024-05",
          "prescriptions_filled": 441
        },
        {
          "region": "North",
          "year_month": "2024-06",
          "prescriptions_filled": 442
        },
        {
          "region": "North",
          "year_month": "2024-07",
          "prescriptions_filled": 417
        },
        {
          "region": "North",
          "year_month": "2024-08",
          "prescriptions_filled": 455
        },
        {
          "region": "North",
          "year_month": "2024-09",
          "prescriptions_filled": 431
        },
        {
          "region": "North",
          "year_month": "2024-10",
          "prescriptions_filled": 445
        },
        {
          "region": "North",
          "year_month": "2024-11",
          "prescriptions_filled": 415
        },
        {
          "region": "North",
          "year_month": "2024-12",
          "prescriptions_filled": 505
        },
        {
          "region": "North",
          "year_month": "2025-01",
          "prescriptions_filled": 490
        },
        {
          "region": "North",
          "year_month": "2025-02",
          "prescriptions_filled": 485
        },
        {
          "region": "North",
          "year_month": "2025-03",
          "prescriptions_filled": 434
        },
        {
          "region": "North",
          "year_month": "2025-04",
          "prescriptions_filled": 462
        },
        {
          "region": "North",
          "year_month": "2025-05",
          "prescriptions_filled": 493
        },
        {
          "region": "North",
          "year_month": "2025-06",
          "prescriptions_filled": 469
        },
        {
          "region": "North",
          "year_month": "2025-07",
          "prescriptions_filled": 449
        },
        {
          "region": "North",
          "year_month": "2025-08",
          "prescriptions_filled": 477
        },
        {
          "region": "North",
          "year_month": "2025-09",
          "prescriptions_filled": 466
        },
        {
          "region": "North",
          "year_month": "2025-10",
          "prescriptions_filled": 467
        },
        {
          "region": "North",
          "year_month": "2025-11",
          "prescriptions_filled": 464
        },
        {
          "region": "North",
          "year_month": "2025-12",
          "prescriptions_filled": 523
        },
        {
          "region": "South",
          "year_month": "2024-01",
          "prescriptions_filled": 469
        },
        {
          "region": "South",
          "year_month": "2024-02",
          "prescriptions_filled": 415
        },
        {
          "region": "South",
          "year_month": "2024-03",
          "prescriptions_filled": 405
        },
        {
          "region": "South",
          "year_month": "2024-04",
          "prescriptions_filled": 393
        },
        {
          "region": "South",
          "year_month": "2024-05",
          "prescriptions_filled": 402
        },
        {
          "region": "South",
          "year_month": "2024-06",
          "prescriptions_filled": 385
        },
        {
          "region": "South",
          "year_month": "2024-07",
          "prescriptions_filled": 418
        },
        {
          "region": "South",
          "year_month": "2024-08",
          "prescriptions_filled": 438
        },
        {
          "region": "South",
          "year_month": "2024-09",
          "prescriptions_filled": 366
        },
        {
          "region": "South",
          "year_month": "2024-10",
          "prescriptions_filled": 426
        },
        {
          "region": "South",
          "year_month": "2024-11",
          "prescriptions_filled": 373
        },
        {
          "region": "South",
          "year_month": "2024-12",
          "prescriptions_filled": 424
        },
        {
          "region": "South",
          "year_month": "2025-01",
          "prescriptions_filled": 474
        },
        {
          "region": "South",
          "year_month": "2025-02",
          "prescriptions_filled": 412
        },
        {
          "region": "South",
          "year_month": "2025-03",
          "prescriptions_filled": 425
        },
        {
          "region": "South",
          "year_month": "2025-04",
          "prescriptions_filled": 409
        },
        {
          "region": "South",
          "year_month": "2025-05",
          "prescriptions_filled": 467
        },
        {
          "region": "South",
          "year_month": "2025-06",
          "prescriptions_filled": 437
        },
        {
          "region": "South",
          "year_month": "2025-07",
          "prescriptions_filled": 390
        },
        {
          "region": "South",
          "year_month": "2025-08",
          "prescriptions_filled": 439
        },
        {
          "region": "South",
          "year_month": "2025-09",
          "prescriptions_filled": 395
        },
        {
          "region": "South",
          "year_month": "2025-10",
          "prescriptions_filled": 431
        },
        {
          "region": "South",
          "year_month": "2025-11",
          "prescriptions_filled": 401
        },
        {
          "region": "South",
          "year_month": "2025-12",
          "prescriptions_filled": 499
        },
        {
          "region": "West",
          "year_month": "2024-01",
          "prescriptions_filled": 391
        },
        {
          "region": "West",
          "year_month": "2024-02",
          "prescriptions_filled": 355
        },
        {
          "region": "West",
          "year_month": "2024-03",